{
  "schema_version": 1,
  "provider_free": true,
  "live_network": false,
  "real_dependency_imports": false,
  "dialect": "finance_facade.provider_edge_matrix.v1",
  "providers": [
    {
      "provider_id": "provider_a",
      "capabilities": [
        "market_data",
        "retry",
        "cache"
      ],
      "terms": {
        "terms_ref": "provider_terms:provider_a:offline",
        "allowed_uses": [
          "fixture_replay",
          "schema_validation"
        ],
        "attribution_required": true,
        "redistribution": "fixture_metadata_only",
        "live_network": false,
        "credential_required": false
      }
    },
    {
      "provider_id": "provider_b",
      "capabilities": [
        "fundamentals",
        "fallback"
      ],
      "terms": {
        "terms_ref": "provider_terms:provider_b:offline",
        "allowed_uses": [
          "fixture_replay",
          "schema_validation"
        ],
        "attribution_required": true,
        "redistribution": "fixture_metadata_only",
        "live_network": false,
        "credential_required": false
      }
    },
    {
      "provider_id": "provider_c",
      "capabilities": [
        "market_data",
        "staleness_check"
      ],
      "terms": {
        "terms_ref": "provider_terms:provider_c:offline",
        "allowed_uses": [
          "fixture_replay",
          "schema_validation"
        ],
        "attribution_required": true,
        "redistribution": "fixture_metadata_only",
        "live_network": false,
        "credential_required": false
      }
    },
    {
      "provider_id": "provider_d",
      "capabilities": [
        "profile",
        "empty_result"
      ],
      "terms": {
        "terms_ref": "provider_terms:provider_d:offline",
        "allowed_uses": [
          "fixture_replay",
          "schema_validation"
        ],
        "attribution_required": true,
        "redistribution": "fixture_metadata_only",
        "live_network": false,
        "credential_required": false
      }
    },
    {
      "provider_id": "provider_e",
      "capabilities": [
        "financials",
        "schema_validation"
      ],
      "terms": {
        "terms_ref": "provider_terms:provider_e:offline",
        "allowed_uses": [
          "fixture_replay",
          "schema_validation"
        ],
        "attribution_required": true,
        "redistribution": "fixture_metadata_only",
        "live_network": false,
        "credential_required": false
      }
    }
  ],
  "edge_rows": [
    {
      "case_id": "retry-cache-rate-limit",
      "category": "retry_cache_error",
      "provider_id": "provider_a",
      "fixture_key": "edge:provider_a:rate_limited:cache_miss",
      "operation": "market_data.fetch",
      "cache_state": "miss",
      "retry": {
        "attempts": 3,
        "retryable": true,
        "backoff": "exponential_jitter"
      },
      "error_envelope": {
        "ok": false,
        "error_code": "RATE_LIMITED",
        "retry_after_seconds": 60
      },
      "fallback": {
        "required": true,
        "attempted": [
          "provider_a",
          "provider_b"
        ],
        "selected_provider": "provider_b",
        "explanation": "Primary provider returned a retryable rate limit during fixture replay; facade selected the next schema-compatible provider."
      },
      "provenance": {
        "fixture_key": "edge:provider_a:rate_limited:cache_miss",
        "source_url_redacted": true,
        "replay_ready": true
      }
    },
    {
      "case_id": "retry-cache-hit-after-timeout",
      "category": "retry_cache_error",
      "provider_id": "provider_a",
      "fixture_key": "edge:provider_a:timeout:cache_hit",
      "operation": "market_data.fetch",
      "cache_state": "hit",
      "retry": {
        "attempts": 2,
        "retryable": true,
        "backoff": "exponential_jitter"
      },
      "error_envelope": {
        "ok": false,
        "error_code": "PROVIDER_TIMEOUT",
        "retry_after_seconds": 0
      },
      "fallback": {
        "required": false,
        "attempted": [
          "provider_a"
        ],
        "selected_provider": "provider_a",
        "explanation": "Timeout was retryable, but a fresh typed-table cache hit satisfied the request without provider fallback."
      },
      "provenance": {
        "fixture_key": "edge:provider_a:timeout:cache_hit",
        "source_url_redacted": true,
        "replay_ready": true
      }
    },
    {
      "case_id": "partial-provider-outage",
      "category": "partial_provider_outage",
      "provider_id": "provider_b",
      "fixture_key": "edge:provider_b:partial_outage",
      "operation": "fundamentals.fetch",
      "cache_state": "bypass",
      "retry": {
        "attempts": 3,
        "retryable": true,
        "backoff": "exponential_jitter"
      },
      "error_envelope": {
        "ok": false,
        "error_code": "PARTIAL_PROVIDER_OUTAGE",
        "retry_after_seconds": 30
      },
      "fallback": {
        "required": true,
        "attempted": [
          "provider_b",
          "provider_e"
        ],
        "selected_provider": "provider_e",
        "explanation": "Only one dataset family was unavailable, so the facade continued to the next provider with matching financials capability."
      },
      "provenance": {
        "fixture_key": "edge:provider_b:partial_outage",
        "source_url_redacted": true,
        "replay_ready": true
      }
    },
    {
      "case_id": "stale-rows",
      "category": "stale_rows",
      "provider_id": "provider_c",
      "fixture_key": "edge:provider_c:stale_rows",
      "operation": "market_data.fetch",
      "cache_state": "stale",
      "retry": {
        "attempts": 1,
        "retryable": false,
        "backoff": "none"
      },
      "error_envelope": {
        "ok": false,
        "error_code": "STALE_ROWS",
        "retry_after_seconds": 0
      },
      "fallback": {
        "required": true,
        "attempted": [
          "provider_c",
          "provider_a"
        ],
        "selected_provider": "provider_a",
        "explanation": "Rows exceeded stale_after_days and were not returned as current market data; fallback preserved typed-table freshness."
      },
      "provenance": {
        "fixture_key": "edge:provider_c:stale_rows",
        "source_url_redacted": true,
        "replay_ready": true
      }
    },
    {
      "case_id": "empty-provider-result",
      "category": "empty_provider_result",
      "provider_id": "provider_d",
      "fixture_key": "edge:provider_d:empty_result",
      "operation": "profile.fetch",
      "cache_state": "miss",
      "retry": {
        "attempts": 1,
        "retryable": false,
        "backoff": "none"
      },
      "error_envelope": {
        "ok": false,
        "error_code": "EMPTY_PROVIDER_RESULT",
        "retry_after_seconds": 0
      },
      "fallback": {
        "required": true,
        "attempted": [
          "provider_d",
          "provider_b"
        ],
        "selected_provider": "provider_b",
        "explanation": "Provider returned an empty but syntactically valid result; facade treated it as no data and tried the next capable provider."
      },
      "provenance": {
        "fixture_key": "edge:provider_d:empty_result",
        "source_url_redacted": true,
        "replay_ready": true
      }
    },
    {
      "case_id": "malformed-response",
      "category": "malformed_response",
      "provider_id": "provider_e",
      "fixture_key": "edge:provider_e:malformed_response",
      "operation": "financials.fetch",
      "cache_state": "bypass",
      "retry": {
        "attempts": 1,
        "retryable": false,
        "backoff": "none"
      },
      "error_envelope": {
        "ok": false,
        "error_code": "MALFORMED_RESPONSE",
        "retry_after_seconds": 0
      },
      "fallback": {
        "required": true,
        "attempted": [
          "provider_e",
          "provider_b"
        ],
        "selected_provider": "provider_b",
        "explanation": "Provider payload failed the facade schema contract, so provider-native fields were discarded and fallback continued."
      },
      "provenance": {
        "fixture_key": "edge:provider_e:malformed_response",
        "source_url_redacted": true,
        "replay_ready": true
      }
    },
    {
      "case_id": "capability-denied",
      "category": "capability_denied",
      "provider_id": "provider_b",
      "fixture_key": "edge:provider_b:capability_denied",
      "operation": "market_data.fetch",
      "cache_state": "bypass",
      "retry": {
        "attempts": 1,
        "retryable": false,
        "backoff": "none"
      },
      "error_envelope": {
        "ok": false,
        "error_code": "CAPABILITY_DENIED",
        "retry_after_seconds": 0
      },
      "fallback": {
        "required": true,
        "attempted": [
          "provider_b",
          "provider_a"
        ],
        "selected_provider": "provider_a",
        "explanation": "Requested operation was outside the provider capability set, so the facade skipped it without live credentials."
      },
      "provenance": {
        "fixture_key": "edge:provider_b:capability_denied",
        "source_url_redacted": true,
        "replay_ready": true
      }
    },
    {
      "case_id": "terms-metadata-required",
      "category": "provider_terms_metadata",
      "provider_id": "provider_terms",
      "fixture_key": "edge:provider_terms:metadata",
      "operation": "provider.enable_live",
      "cache_state": "bypass",
      "retry": {
        "attempts": 0,
        "retryable": false,
        "backoff": "none"
      },
      "error_envelope": {
        "ok": false,
        "error_code": "TERMS_METADATA_REQUIRED",
        "retry_after_seconds": 0
      },
      "fallback": {
        "required": false,
        "attempted": [],
        "selected_provider": "",
        "explanation": ""
      },
      "provenance": {